5,Dr. Doctorson,2018-01-25,3,5,9,division2, Drag?e brownie cupcake cookie. Brownie candy tootsie roll caramels chocolate cake dessert. Cupcake muffin carrot cake cupcake marzipan macaroon croissant toffee. Macaroon gingerbread liquorice sweet gingerbread. Donut cookie sugar plum liquorice sugar plum candy canes lemon drops. Sweet roll macaroon lemon drops apple pie chupa chups. Lollipop carrot cake cheesecake bear claw oat cake carrot cake fruitcake. Fruitcake candy canes cotton candy souffl? oat cake ice cream. Jelly-o cake cupcake croissant carrot cake. Apple pie icing sweet. Topping candy canes dessert powder muffin macaroon marshmallow. Chupa chups macaroon liquorice. Lemon drops drag?e carrot cake souffl? sweet.
12,paul,1935-05-30,2,3,12,division2,this guy said he had something stuck in his
124,that guy,1943-11-11,2,3,124,division2,heeh
51,Drottningen,2018-04-06,1,3,7,division1,hi i am drottningen
1,John Doe,2018-01-02,1,4,2,division1,Sweet roll chocolate tootsie roll cupcake pudding pastry gummies sugar plum bear claw. Carrot cake cake marzipan. Gummi bears sweet roll brownie cake. Pie jujubes pie gummi bears donut danish cheesecake sesame snaps apple pie. Cake drag?e oat cake caramels danish. Chupa chups carrot cake gummies caramels cotton candy. Sugar plum chocolate cake pastry macaroon gummi bears candy cupcake. Donut dessert dessert lollipop. Powder pudding brownie chocolate cake cake sweet drag?e. Toffee biscuit danish fruitcake cake tootsie roll. Carrot cake cupcake biscuit. Tiramisu muffin gummies.
2,Carl XVI Gustaf,2018-01-08,1,5,2,division1,I am the king of kings
4,Obama,2018-01-07,5,124,4,division2, Tiramisu topping liquorice. Halvah cotton candy carrot cake cookie carrot cake souffl? tiramisu. Cheesecake croissant marzipan sweet macaroon pie. Candy canes wafer marzipan pudding bear claw. Chocolate cake jelly beans chocolate cake dessert. Powder croissant toffee danish powder pastry bonbon pudding. Cake gummies caramels. Cotton candy candy canes chocolate bear claw. Jelly beans marshmallow brownie cake pudding cake halvah cupcake gummi bears. Liquorice halvah gingerbread tart chocolate cake candy caramels pie liquorice. Caramels caramels liquorice. Cookie biscuit souffl?. Gingerbread marshmallow jelly beans jujubes chocolate cake halvah candy canes tart powder. Liquorice powder gummi bears.